IncidentId,UniqueId,Name,Location,Latitude,Longitude,AcresBurnedDisplay,PercentContainedDisplay,ExternalIncidentLink,CountiesList,UpdatedDate,StartedDate,AdminUnit,IncidentTypeDisplay,Url,IsActive
1027,7e1e0693-4690-4d11-afe6-74652d68c3ef,Chorro Fire,Maricopa Highway 33 & Chorro Grande Canyon, north of Ojai ,0.0,0.0,282,100%,,Ventura,2015-08-12 08:00:00,2015-08-02,USFS - Los Padres National Forest,,https://www.fire.ca.gov/incidents/2015/8/2/chorro-fire/,N,
1028,a063b897-28aa-43e5-b608-1b79f770050c,Frog Fire,SW of Lava Campground,41.399,-121.392,4,863,100%,,Modoc,2015-07-31 20:00:00,2015-07-30,USFS Modoc National Forest,,https://www.fire.ca.gov/incidents/2015/7/30/frog-fire/,N,
1029,7c83452f-e6f0-47af-aa25-1d0fff3a594f,River Complex,Near the communities of Dailey Ranch, Hoboken, Denny and Trinity Village.,0.0,0.0,77,081,100%,,Trinity,2015-07-31 20:25:00,2015-07-30,USFS - Shasta-Trinity National Forest,,https://www.fire.ca.gov/incidents/2015/7/30/river-complex/,N,
1030,dfd02b2e-7e2d-4636-a178-0ebff2d170c8,Fern Fire,Fern Rd and Oak Run Rd, 1 mile east of the Community of Oak Run,40.67868,-121.93244,75,100%,,Shasta,2015-08-04 18:00:00,2015-08-02,CAL FIRE Shasta-Trinity Unit,,https://www.fire.ca.gov/incidents/2015/8/2/fern-fire/,N,
1031,f136ba8d-f6bb-4bad-9815-1d56f9dc8650,White Fire,off White Oak Ln, east of Santa Maria,34.9522,-120.2903,52,100%,,Santa Barbara,1969-12-31 16:00:00,2015-08-01,Santa Barbara County Fire,,https://www.fire.ca.gov/incidents/2015/8/1/white-fire/,N,
1032,d95a4f8c-008a-4691-b1b2-9173b4dca34d,Scales Fire,Cajon Pass, I-15 and Highway 138,0.0,0.0,65,100%,,San Bernardino,2015-08-05 09:00:00,2015-08-01,San Bernardino National Foerst,,https://www.fire.ca.gov/incidents/2015/8/1/scales-fire/,N,
1033,139766ba-33ac-442e-9a6b-b78d270c110a,Francis Fire,Colgate Powerhouse south of Dobbins,39.33303,-121.18735,30,100%,,Yuba,2015-08-05 07:30:00,2015-08-03,CAL FIRE Nevada-Yuba-Placer Unit,,https://www.fire.ca.gov/incidents/2015/8/3/francis-fire/,N,
1034,7243645e-960d-4422-a281-cc6b42ca8938,South Complex,Hyampom area,0.0,0.0,29,416,100%,,Trinity,2015-08-03 14:00:00,2015-07-30,USFS - Shasta - Trinity National Forest,,https://www.fire.ca.gov/incidents/2015/7/30/south-complex/,N,
1035,6c5fcfc7-659a-44ee-b225-c4ae919882e7,Point Fire,Gas Point and Happy Valley Rd, west of Cottonwood,40.3929,-122.40546,59,100%,,Shasta,2015-08-04 08:15:00,2015-08-03,CAL FIRE Shasta-Trinity Unit,,https://www.fire.ca.gov/incidents/2015/8/3/point-fire/,N,
1036,c4da9583-d7ad-4d8c-834c-3688c1bf3949,Nickowitz Fire,near Orleans,0.0,0.0,7,509,100%,,Del Norte,2015-11-09 12:00:00,2015-08-01,USFS - Six Rivers National Forest,,https://www.fire.ca.gov/incidents/2015/8/1/nickowitz-fire/,N,
1037,450e1ea6-2ed7-4df2-b533-698b0c86dd40,Gasquet Complex,Gasquet area,0.0,0.0,30,361,100%,,Del Norte,2015-08-04 09:00:00,2015-07-31,USFS - Six Rivers National Forest,,https://www.fire.ca.gov/incidents/2015/7/31/gasquet-complex/,N,
1038,8c030522-da26-492f-80e2-a249e741d9cb,Mendocino National Forest Lightning Complex,throughout Mendocino National Forest,0.0,0.0,227,100%,,Mendocino,2015-08-07 21:00:00,2015-07-30,USFS - Mendocino National Forest,,https://www.fire.ca.gov/incidents/2015/7/30/mendocino-national-forest-lightning-complex/,N,
1039,293c6467-7b2e-43a3-94c1-41cec4339b67,Dodge Fire,17 miles northeast of Ravendale,40.938,-120.105,10,570,100%,,Lassen,2015-08-04 10:37:00,2015-08-03,Bureau of Land Management,,https://www.fire.ca.gov/incidents/2015/8/3/dodge-fire/,N,
1040,3cc1aa4c-b87d-4b4d-99b1-83dc56291b33,De Luz Fire,De Luz Rd and De Luz Murrieta Rd,33.4115972,-117.2886249,55,100%,,San Diego,2015-08-10 15:05:00,2015-08-09,CAL FIRE San Diego Unit,,https://www.fire.ca.gov/incidents/2015/8/9/de-luz-fire/,N,
1041,ffbc1cb8-be33-4483-8442-85ab2587dce4,36 Fire,off Highwat 36 near Paynes Creek,40.3506868,-121.7786799,110,100%,,Tehama,2015-08-09 20:30:00,2015-08-08,CAL FIRE Tehama-Glenn Unit,,https://www.fire.ca.gov/incidents/2015/8/8/36-fire/,N,
1042,94a7ae52-fed9-4997-b972-1761aa4b89ca,Jerusalem Fire,Jerusalem Valley area, northeast of Middletown,38.8142503,-122.4867319,25,118,100%,,Lake, Napa,2015-08-25 06:45:00,2015-08-09,CAL FIRE Sonoma-Lake-Napa Unit,,https://www.fire.ca.gov/incidents/2015/8/9/jerusalem-fire/,N,
1043,8049295f-23fe-4c7e-9be1-cded644dc737,Horno Fire,Camp Pendleton,0.0,0.0,1,850,100%,,San Diego,2015-08-18 19:00:00,2015-08-13,Camp Pendleton Military Base,,https://www.fire.ca.gov/incidents/2015/8/13/horno-fire/,N,
1044,4c10bd30-e348-430c-9f12-932c8a03f6f8,Rustic Fire,Rustic Hills Drive in the Wood Ranch area Simi Valley,0.0,0.0,186,100%,,Ventura,2015-08-16 12:00:00,2015-08-14,Ventura County Fire Department,,https://www.fire.ca.gov/incidents/2015/8/14/rustic-fire/,N,
1045,a195c911-2179-4591-ab00-e67297f2db04,Walker Fire,north of Walker Lake & north of June Lake Loop,0.0,0.0,3,676,100%,,Mono,2015-08-23 17:45:00,2015-08-14,Inyo National Forest,,https://www.fire.ca.gov/incidents/2015/8/14/walker-fire/,N,
1046,15b01fbd-1962-4092-bcc4-d95ab7fafea2,Warm Fire,Lake Hughes Rd at Warm Springs Rehab Center,0.0,0.0,300,100%,,Los Angeles,2015-08-16 20:00:00,2015-08-16,Angeles National Forest,,https://www.fire.ca.gov/incidents/2015/8/16/warm-fire/,N,
1047,fde8f46b-0225-4489-be2d-68453a524190,Cuesta Fire,Off Highway 101 in the Cuesta Grade, north of San Luis Obispo,35.3477,-120.6269,2,446,100%,,San Luis Obispo,2015-08-28 18:15:00,2015-08-16,CAL FIRE San Luis Obispo Unit/ Los Padres National Forest ,,https://www.fire.ca.gov/incidents/2015/8/16/cuesta-fire/,N,
1048,0011ce0f-5493-4bef-b6e1-4674a0393b0c,Lincoln Fire,off Lincoln Ave, in the Whittier Narrows Park, City of Montebello,0.0,0.0,374,100%,,Los Angeles,2015-08-20 08:10:00,2015-08-16,Los Angeles County Fire Department /  Montebello Fire Department,,https://www.fire.ca.gov/incidents/2015/8/16/lincoln-fire/,N,
1049,cbaa4a28-c732-4c11-9d44-7da6c3bd8e42,Horse Fire,Saddle Mountain Road, 6 miles NE Shelter Cove,40.1058823,-124.0720419,146,100%,,Humboldt,2015-08-29 07:00:00,2015-08-18,CAL FIRE Humboldt-Del Norte Unit,,https://www.fire.ca.gov/incidents/2015/8/18/horse-fire/,N,
1050,8fc920eb-ca45-4d77-9a92-1326eca602d6,Tesla Fire,off Tesla Rd near Correl Hollow, between Livermore and Tracy,37.3845,-121.3732,2,700,100%,,Alameda,2015-08-22 18:30:00,2015-08-19,CAL FIRE Santa Clara Unit,,https://www.fire.ca.gov/incidents/2015/8/19/tesla-fire/,N,
1051,909d6135-070c-4e3b-ba22-23877fb603c3,Grade Fire,Jerusalem Grade Rd & June Bug Rd, 7 miles northeast of Middletown,38.831478,-122.53428,22,100%,,Lake,2015-08-25 18:30:00,2015-08-24,CAL FIRE Sonoma Lake Napa,,https://www.fire.ca.gov/incidents/2015/8/24/grade-fire/,N,
1052,33b7d824-9803-4c07-8231-9cf210e34417,Flat Fire ,southeast of Woody, south of Poso Flat Road & Burke Creek,0.0,0.0,167,100%,,Kern,2015-08-21 18:45:00,2015-08-20,Kern County Fire Department ,,https://www.fire.ca.gov/incidents/2015/8/20/flat-fire/,N,
1053,bd869df0-5333-4b9f-957f-b3d563f09f94,Prairie Fire,LaHonda Well area northeast of the community of Tennant,0.0,0.0,69,100%,,Siskiyou,2015-08-22 18:00:00,2015-08-20,Klamath National Forest,,https://www.fire.ca.gov/incidents/2015/8/20/prairie-fire/,N,
1054,02d470c1-bf41-4ff9-9424-f680cef5bbbc,Peterson Fire,off Peterson Lane and Adobe Creek Road, near Kelseyville,38.925764,-122.879272,215,100%,,Lake,2015-08-27 15:15:00,2015-08-22,CAL FIRE Sonoma-Lake-Napa Unit,,https://www.fire.ca.gov/incidents/2015/8/22/peterson-fire/,N,
1055,d0875efe-54fb-4cc2-b647-4f4d210df118,Summit Fire,at Knickerbocker Road and Pine Knot, south of Big Bear Lake,34.23,-116.883,55,100%,,San Bernardino,2015-09-11 15:00:00,2015-08-23,USFS - San Bernardino National Forest,,https://www.fire.ca.gov/incidents/2015/8/23/summit-fire/,N,
1056,da522578-443a-4c52-a9bb-d72bbb84dcdb,Democrat Fire,Democrat Gulch, west of Weaverville ,40.724898,-122.96174,128,100%,,Trinity,2015-08-29 18:45:00,2015-08-25,CAL FIRE Shasta-Trinity Unit,,https://www.fire.ca.gov/incidents/2015/8/25/democrat-fire/,N,
1057,0eed7005-6ace-4eb2-8919-eb131c246f84,Elk Fire,Off of Elk Mountain Road and Mount Dinger Road, north of Upper Lake,55.23,-122.0,673,100%,,Lake,2015-09-08 19:28:00,2015-09-02,CAL FIRE Sonoma-Lake-Napa Unit / Mendocino National Forest,,https://www.fire.ca.gov/incidents/2015/9/2/elk-fire/,N,
1058,3435fd06-f77e-42c3-8fa5-261cf0cb828c,Olive Fire,Off of Olive Tree Lane, south of Oroville ,26.42,-121.0,72,100%,,Butte,2015-09-03 19:35:00,2015-09-02,CAL FIRE Butte Unit,,https://www.fire.ca.gov/incidents/2015/9/2/olive-fire/,N,
1059,bb500714-470e-4529-a15a-11d96e85cc68,Kramer Fire ,off of Kramer Road and 4 Corners Road, west of Beiber ,41.12362,-121.194256,30,100%,,Lassen,2015-08-30 08:00:00,2015-08-29,CAL FIRE Lassen-Modoc Unit,,https://www.fire.ca.gov/incidents/2015/8/29/kramer-fire/,N,
1060,40f44488-051f-4412-a577-c932f2ce751d,Oak Fire,off Old Oak Ranch Rd & Big Hill Rd in the Cedar Ridge area, northeast of Sonora ,38.04684,-120.30188,108,100%,,Tuolumne,2015-09-15 19:15:00,2015-09-08,CAL FIRE Tuolumne-Calaveras Unit,,https://www.fire.ca.gov/incidents/2015/9/8/oak-fire/,N,
1061,20348e67-4eac-42ae-ad4e-57ca0add2914,Apple Fire,Off Apple Rd in Wilton,0.0,0.0,110,100%,,Sacramento,2015-09-03 14:30:00,2015-09-03,CAL FIRE Amador-El Dorado Unit,,https://www.fire.ca.gov/incidents/2015/9/3/apple-fire/,N,
1062,5046e2ed-e2c3-4932-8f89-64dcdf19022d,Browns Fire,Hwy 299 and Little Browns Creek Rd east of Weaverville,40.0,41.46,35,100%,,Trinity,2015-09-10 17:05:00,2015-09-08,CAL FIRE Shasta-Trinity Unit,,https://www.fire.ca.gov/incidents/2015/9/8/browns-fire/,N,
1063,e1ad9125-1179-4d00-891b-7b62699069d0,Antelope Fire,Antelope Canyon south of Tehachapi,0.0,0.0,45,100%,,Kern,2015-09-15 19:10:00,2015-09-09,Kern County Fire Department,,https://www.fire.ca.gov/incidents/2015/9/9/antelope-fire/,N,
1064,75c14933-9916-4dfe-ac66-7d98706a5172,Center Fire,Center Rd, east of Susanville,40.400196,-120.553075,40,100%,,Lassen,2015-09-10 07:49:00,2015-09-09,CAL FIRE Lassen - Modoc Unit,,https://www.fire.ca.gov/incidents/2015/9/9/center-fire/,N,
1065,9a3df964-7794-411c-9043-967476fe77e6,Creek Fire,Squaw Valley Road and Sand Creek Road,40.400196,-120.553075,170,100%,,Fresno,2015-09-11 19:17:00,2015-09-09,CAL FIRE Fresno Kings Unit,,https://www.fire.ca.gov/incidents/2015/9/9/creek-fire/,N,
1066,13466833-32d1-418b-b145-f7ce1f7bf66e,Butte Fire,east of Jackson,38.32974,-120.70418,70,868,100%,,,2015-10-15 19:45:00,2015-09-09,CAL FIRE Amador - El Dorado Unit,,https://www.fire.ca.gov/incidents/2015/9/9/butte-fire/,N,
1067,f58b224d-b7d2-4311-9d65-c7440a1ceb53,Pacheco Fire,off Hwy 152 at Dinosaur Point, 3 miles west of San Luis Reservoir,0.0,0.0,215,100%,,Santa Clara,2015-09-10 18:50:00,2015-09-09,CAL FIRE Santa Clara Unit,,https://www.fire.ca.gov/incidents/2015/9/9/pacheco-fire/,N,
1068,d01b8e54-43e5-4643-8742-a14e1c2980f8,Tenaya Fire,north rim of Yosemite Valley, east of Yosemite Falls,0.0,0.0,415,100%,,Mariposa,2015-09-11 11:00:00,2015-09-07,USFS - Yosemite National Park,,https://www.fire.ca.gov/incidents/2015/9/7/tenaya-fire/,N,
1069,f7067bff-efb4-4ca6-a627-6145836857ec,Lumpkin Fire,off Lumpkin Road and Forbestown Road, Robinson Mill,39.5218,-121.3363,1,042,100%,,Butte,2015-09-17 19:30:00,2015-09-11,CAL FIRE Butte Unit,,https://www.fire.ca.gov/incidents/2015/9/11/lumpkin-fire/,N,
1070,dbd39ec2-546c-4afc-9ff2-b1939eead03e,Walker Fire,Windwalker Ln & Small Farms Dr in Igo,40.47512,-122.52541,109,100%,,Shasta,2015-09-13 10:15:00,2015-09-11,CAL FIRE Shasta-Trinity Unit,,https://www.fire.ca.gov/incidents/2015/9/11/walker-fire/,N,
1071,f843961b-2c26-427d-87ba-0bde7ce9ecba,Banister Fire,off Wood Ranch Parkway 2 miles sw of Simi Valley,0.0,0.0,29,100%,,Ventura,2015-11-12 18:00:00,2015-11-11,Ventura County Fire Department,,https://www.fire.ca.gov/incidents/2015/11/11/banister-fire/,N,
1072,77d732e5-1f7d-4f9b-a5f8-269b6f7312c5,Valley Fire,southern Lake County,0.0,0.0,76,067,100%,,,2015-10-15 19:45:00,2015-09-12,CAL FIRE Sonoma-Lake-Napa Unit,,https://www.fire.ca.gov/incidents/2015/9/12/valley-fire/,N,
1073,897d01d8-dd38-43e2-bcd6-fa62aac03318,Munjar Fire,Munjar Rd, 10 miles north of Chico,39.8707,-121.8938,104,100%,,Butte,2015-10-02 17:50:00,2015-10-02,CAL FIRE Butte Unit ,,https://www.fire.ca.gov/incidents/2015/10/2/munjar-fire/,N,
1074,8c788c0a-d1fc-46d7-a17c-23f786831f7d,Rough Fire ,5 miles North of Hume Lake and 2.5 miles to the southwest of Spanish Mountain 5,36.874,-118.905,151,623,100%,,Fresno,2015-11-09 12:00:00,2015-07-31,Sierra National Forest ,,https://www.fire.ca.gov/incidents/2015/7/31/rough-fire/,N,
1076,c6f0705e-8bec-4a00-92a7-dc47245de7fa,Solimar Fire,6 Miles NW of Ventura - North of Highway 101, West of Hwy 33,  in the SRA,34.31953,-119.34512,1,388,100%,,,2015-12-29 10:00:00,2015-12-25,Ventura County Fire Department,,https://www.fire.ca.gov/incidents/2015/12/25/solimar-fire/,N,
1077,3f31752f-4f51-4705-9fe4-50beec88a0e8,Potrero Fire,Hidden Valley area, southwest of Thousand Oaks,34.15,-118.879444,50,100%,,Ventura,2015-11-07 16:45:00,2015-11-07,Ventura County Fire Department,,https://www.fire.ca.gov/incidents/2015/11/7/potrero-fire/,N,
1078,88e1ae5b-593f-4d0d-958d-bd56a877a535,Meridian Fire,off Hwy 99 & Meridian Rd, north of Chico,0.0,0.0,860,100%,,Butte,2015-10-04 18:40:00,2015-10-03,CAL FIRE Butte Unit / Butte County Fire,,https://www.fire.ca.gov/incidents/2015/10/3/meridian-fire/,N,
1079,e4223f98-44fa-44bd-9ec9-3219206068d2,Military Fire,Along Military Pass Road ,0.0,0.0,58,100%,,Siskiyou,2015-10-10 18:45:00,2015-10-10,Shasta-Trinity National Forest ,,https://www.fire.ca.gov/incidents/2015/10/10/military-fire/,N,
1080,471b941f-d7f4-4d85-8570-a9c80da81434,King Fire ,Old Control Road, 2 Miles West of California Hot Springs,0.0,0.0,36,100%,,,2015-10-13 15:55:00,2015-10-09,CAL FIRE Tulare Unit,,https://www.fire.ca.gov/incidents/2015/10/9/king-fire/,N,
1081,8e71e23c-6161-480e-b8ca-f03147475e4d,Cienega Fire,Cienega Rd & Limekiln Rd, south of Hollister,36.70854,-121.32734,670,100%,,San Benito,2015-10-16 18:00:00,2015-10-12,CAL FIRE San Benito - Monterey Unit,,https://www.fire.ca.gov/incidents/2015/10/12/cienega-fire/,N,
1082,fbd3c0a8-7191-473c-bb05-43616711b6c5,Gibraltar Fire,between Montecito Peak and Coldspring Saddle,34.4828,-119.63216,21,100%,,Santa Barbara,2015-11-09 12:00:00,2015-10-29,Los Padres National Forest,,https://www.fire.ca.gov/incidents/2015/10/29/gibraltar-fire/,N,
1083,c27d03c6-361e-44b3-8335-a1fe06f88fd7,McCourtney Fire,off McCourtney Rd & Perimeter Rd, east of Camp Far West Reservoir ,39.081,-121.194,30,100%,,Nevada,2015-09-21 14:36:00,2015-09-22,CAL FIRE Nevada-Yuba-Placer Unit,,https://www.fire.ca.gov/incidents/2015/9/22/mccourtney-fire/,N,
1084,1f54817c-8832-4a47-8ede-ab8072f52677,Tassajara Fire,Tassajara Rd at Carmel Valley Rd,36.3699644,-121.589554,1,086,100%,,Monterey,2015-09-27 18:15:00,2015-09-19,CAL FIRE San Benito-Monterey Unit,,https://www.fire.ca.gov/incidents/2015/9/19/tassajara-fire/,N,
1085,9569dcd6-c94f-4849-a90a-db58bfc77bee,Laureles Fire,off Laureles Grade and Highway 68 ,36.5696373,-121.7556029,95,100%,,Monterey,2015-09-21 18:20:00,2015-09-19,CAL FIRE San Benito-Monterey Unit,,https://www.fire.ca.gov/incidents/2015/9/19/laureles-fire/,N,
